[
  {
    "id": 1,
    "customerType": "未知",
    "name": "陈总",
    "age": 38,
    "location": "广州番禺",
    "industry": "",
    "description": "陈总，38岁，广州番禺，小型外贸B2B公司老板，卖五金配件到东南亚。公司6个人（含自己），年营收300-500万，主要靠阿里国际站和1688接单。每天收到大量询盘，很多是重复问题（MOQ、交期、材质），只有一个业务员在回复，经常漏单。他听朋友说\"AI客服很火\"，觉得自己也该搞一个。真实愿意付钱的点：减少业务员工作量、不漏单、让公司看起来\"有科技感\"。",
    "painPoint": "",
    "willingness": "",
    "budget": "",
    "difficulty": "中等",
    "quote": {
      "low": 1500,
      "standard": 3000,
      "high": 5000,
      "recommended": 3000
    },
    "product": "",
    "deliveryDays": "5-7天",
    "communicationTips": "第一轮问什么：\n- \"陈总，您现在的客户主要通过什么渠道来问？阿里国际站还是WhatsApp？\"\n- \"您手上有整理好的产品资料吗？比如产品目录、常见问答？\"\n- \"您最希望AI回答哪些类型的问题？\"\n第二轮确认什么：集成平台、回答语言（英文还是中英双语）、验收标准\n判断预算：他说\"朋友花了一千多\"，实际预算大概1000-3000。需要引导理解复杂度。\n判断麻烦客户：中等麻烦。会不断拿朋友例子压价，但人还算讲道理。\n引导模糊需求：\"陈总，我建议先做一个demo，您先试试效果，满意了再集成到平台上，风险最小。\"",
    "closingScript": "微信版：\"陈总，我给您出三个方案，最基础的1500块，大概5天就能做好，您先试试效果。如果觉得好，后面再加功能也行，不用一次花太多钱。\"\n正式版：\"陈总，考虑到您目前的业务规模和需求优先级，我建议先从基础版入手，投入小、见效快，后续可以平滑升级。\"\n应对太贵：\"陈总您看，您业务员一个月工资多少？这个AI客服相当于一次性投入，后面24小时不停干活，比请人划算多了。\"\n应对考虑一下：\"没问题陈总，您考虑一下。不过我这边排期比较紧，如果您这周定下来，我可以优先给您做。\"",
    "riskPoints": [
      "最大翻车点：客户没有整理好的产品资料，导致AI回答不准确，客户觉得\"AI不好用\"",
      "提前规避：开工前要求客户提供完整资料，资料不全额外收费帮整理",
      "合同条款：①交付后7天内免费修改；②以客户提供的资料为准，不保证AI回答100%准确；③超出原始需求的修改另计费",
      "停止条件：客户连续3天不提供必要资料，项目暂停，已付款不退"
    ],
    "keyLearning": "",
    "customerQuote": "小赵啊，我朋友公司搞了个AI客服，效果还不错，我也想弄一个。就是那种客户问什么它都能答的那种。你帮我搞一个呗，大概多少钱？",
    "surfaceNeed": "做一个AI自动回复询盘的客服",
    "realNeed": "能回答五金配件专业问题的智能问答系统，集成到阿里国际站或WhatsApp",
    "hiddenRisks": [
      "①没有整理过产品FAQ数据，需要从头整理；②阿里国际站接口不一定开放；③对AI效果期望过高，觉得100%能替代人工"
    ],
    "worthTaking": true,
    "firstRoundQuestions": [
      "陈总，您现在的客户主要通过什么渠道来问？阿里国际站还是WhatsApp？",
      "您手上有整理好的产品资料吗？比如产品目录、常见问答？",
      "您最希望AI回答哪些类型的问题？"
    ],
    "acceptanceCriteria": "能正确回答80%以上常见产品问题，响应时间<3秒",
    "biggestRisk": "客户没有整理好的产品资料，导致AI回答不准确，客户觉得\"AI不好用\"",
    "stopConditions": [
      "客户连续3天不提供必要资料，项目暂停，已付款不退"
    ]
  },
  {
    "id": 2,
    "customerType": "未知",
    "name": "王姐",
    "age": 32,
    "location": "深圳",
    "industry": "",
    "description": "王姐，32岁，深圳，自创奶茶品牌\"XX茶\"，3家直营店，正在扩张加盟。需要大量社交媒体内容做品牌推广。自己拍视频、写文案、做图片，忙不过来，效果也一般。看到别人用AI批量生成内容，觉得自己也可以试试。真实愿意付钱的点：节省内容制作时间、让社交媒体内容看起来更专业。",
    "painPoint": "",
    "willingness": "",
    "budget": "",
    "difficulty": "中等",
    "quote": {
      "low": 800,
      "standard": 2000,
      "high": 4000,
      "recommended": 2000
    },
    "product": "",
    "deliveryDays": "7-10天",
    "communicationTips": "第一轮问什么：\n- \"王姐，您现在发的内容主要是哪类？新品推荐、活动促销还是日常打卡？\"\n- \"您的品牌有什么固定风格吗？色系、字体、文案风格？\"\n- \"您平时用什么工具做图？\"\n第二轮确认什么：输出格式、品牌调性参考（让她发几个觉得好的案例）、修改次数\n判断预算：小红书接单价格她肯定看过，预算1000-3000元。\n判断麻烦客户：偏麻烦。做内容的人审美主观性强，可能反复修改。\n引导模糊需求：\"王姐，我建议先帮您做5条样例内容，您看看风格满不满意，满意了再批量做。\"",
    "closingScript": "微信版：\"王姐，2000块搞定一套完整的内容生成工作流，以后您每天只需要输入一个主题，文案和图片就出来了，比自己写快10倍。\"\n应对太贵：\"王姐您算一下，您请一个兼职文案一个月多少钱？这个一次性投入，后面一直能用。\"\n应对考虑一下：\"没问题，您先看看我之前做的效果（发几个Demo截图），觉得可以再聊。\"",
    "riskPoints": [
      "最大翻车点：AI生成的图片风格不稳定，客户觉得\"不像我的品牌\"",
      "提前规避：先做3个风格测试样例让客户选，确认风格后再批量做",
      "合同条款：①包含2轮风格调整；②超出2轮按300元/轮收费；③交付后功能问题免费修，审美偏好调整另计",
      "停止条件：客户连续推翻已确认的设计方向，需重新报价"
    ],
    "keyLearning": "",
    "customerQuote": "我看现在AI可以自动生成小红书文案和图片对吧？我每天要发3-5条内容，实在写不过来。你能不能帮我搞一个，我输入主题它就能给我出文案加图片那种？",
    "surfaceNeed": "AI自动生成小红书文案+配图",
    "realNeed": "一个内容工作流：输入主题→生成符合品牌调性的文案→生成配图→一键导出",
    "hiddenRisks": [
      "①AI生成的图片风格可能不稳定，需反复调整；②品牌调性难以用prompt精确控制；③可能要求无限次修改"
    ],
    "worthTaking": true,
    "firstRoundQuestions": [
      "王姐，您现在发的内容主要是哪类？新品推荐、活动促销还是日常打卡？",
      "您的品牌有什么固定风格吗？色系、字体、文案风格？",
      "您平时用什么工具做图？"
    ],
    "acceptanceCriteria": "生成的文案符合小红书风格，图片风格与品牌一致，单条内容生成时间<5分钟",
    "biggestRisk": "AI生成的图片风格不稳定，客户觉得\"不像我的品牌\"",
    "stopConditions": [
      "客户连续推翻已确认的设计方向，需重新报价"
    ]
  },
  {
    "id": 3,
    "customerType": "未知",
    "name": "刘哥",
    "age": 29,
    "location": "义乌",
    "industry": "",
    "description": "刘哥，29岁，义乌，做拼多多和淘宝小店，卖家居收纳用品。一个人做店，老婆帮忙发货，SKU大概50-80个。商品详情页都是自己用美图秀秀做的，很粗糙，转化率上不去。看到同行用AI做的详情页很漂亮，觉得自己也该升级。真实愿意付钱的点：提升详情页质量→提高转化率→多卖货。",
    "painPoint": "",
    "willingness": "",
    "budget": "",
    "difficulty": "中等",
    "quote": {
      "low": 800,
      "standard": 2000,
      "high": 5000,
      "recommended": 2000
    },
    "product": "",
    "deliveryDays": "5-7天",
    "communicationTips": "第一轮问什么：\n- \"刘哥，您现在有多少个SKU需要做详情页？\"\n- \"每个详情页大概需要几张图？\"\n- \"您有产品实拍图吗？AI生图需要参考。\"\n第二轮确认什么：交付格式（PSD还是JPG/PNG）、修改次数、是否需要包含文案\n判断预算：他说\"一张50块\"，说明预算很低。需要按包价报价。\n判断麻烦客户：偏麻烦。义乌电商老板对价格极度敏感，可能反复砍价。\n引导模糊需求：\"刘哥，我建议我们先做一个样品，您看看效果，满意了再批量做其他款。\"",
    "closingScript": "微信版：\"刘哥，800块先帮您做5个款的详情页，您看看效果，满意了再继续。平均下来每个款160块，比找设计师还划算，而且速度快。\"\n应对太贵：\"刘哥，一张好的详情页能让转化率提升20%以上，您一个SKU一个月多卖几单就回本了。\"\n应对考虑一下：\"行，您先看看我给您做的样品图（发参考图），觉得可以随时找我。\"",
    "riskPoints": [
      "最大翻车点：AI生成的产品图与实物差距大，客户投诉\"不像\"",
      "提前规避：基于客户提供的实拍图做二次设计，不完全靠AI凭空生成",
      "合同条款：①每个SKU包含2次免费修改；②超出修改次数按50元/次收费；③产品信息以客户提供为准",
      "停止条件：客户提供的产品图片质量太差无法使用"
    ],
    "keyLearning": "",
    "customerQuote": "兄弟，我这个详情页做得太烂了，你能不能用AI帮我重新做一下？就那种看起来很高级的感觉，参考一下同行（发了几个链接）。大概多少钱一张？",
    "surfaceNeed": "用AI做商品详情页图片",
    "realNeed": "批量制作高质量详情页，包含产品展示、卖点说明、使用场景图",
    "hiddenRisks": [
      "①AI生图的产品细节可能不准确；②50-80个SKU全做工作量巨大；③可能每个都要反复改"
    ],
    "worthTaking": true,
    "firstRoundQuestions": [
      "刘哥，您现在有多少个SKU需要做详情页？",
      "每个详情页大概需要几张图？",
      "您有产品实拍图吗？AI生图需要参考。"
    ],
    "acceptanceCriteria": "图片清晰度满足平台要求，产品信息准确，排版美观",
    "biggestRisk": "AI生成的产品图与实物差距大，客户投诉\"不像\"",
    "stopConditions": [
      "客户提供的产品图片质量太差无法使用"
    ]
  },
  {
    "id": 4,
    "customerType": "未知",
    "name": "Amy老师",
    "age": 30,
    "location": "上海",
    "industry": "",
    "description": "Amy老师，30岁，上海，独立留学顾问工作室，主要做英美硕士申请。2个顾问+1个文案，一年接40-60个学生。文书全靠人工写，一个学生一套文书（PS+CV+推荐信）要花2-3天，旺季忙不过来。想用AI辅助写文书，提高效率，但又怕AI味太重被学校发现。真实愿意付钱的点：提高文书产出效率，旺季不丢单。",
    "painPoint": "",
    "willingness": "",
    "budget": "",
    "difficulty": "偏麻烦",
    "quote": {
      "low": 2000,
      "standard": 5000,
      "high": 10000,
      "recommended": 5000
    },
    "product": "",
    "deliveryDays": "10-14天",
    "communicationTips": "第一轮问什么：\n- \"Amy老师，你们现在写一篇PS大概要多长时间？\"\n- \"你们有没有文书模板库或者过往优秀文书？\"\n- \"你们主要申请哪些学校？不同学校的文书要求差别大吗？\"\n第二轮确认什么：输入输出格式、是否需要对接学生管理系统、数据安全要求\n判断预算：留学机构利润率高，预算3000-8000元。\n判断麻烦客户：中等。比较专业，但可能对文书质量要求很高。\n引导模糊需求：\"Amy老师，我建议先针对PS做一个MVP，您用一个真实学生案例测试效果，满意了再扩展到CV和推荐信。\"",
    "closingScript": "微信版：\"Amy老师，5000块做一套完整的文书辅助系统，PS、CV、推荐信都能生成初稿。以后每个学生少花一半时间写文书，旺季再也不用加班了。\"\n应对太贵：\"Amy老师，您一个学生的中介费是多少？这个工具一年能帮您多接多少学生？投入产出比算一下就知道值不值了。\"\n应对考虑一下：\"没问题。我这边可以先用一个学生的案例帮您做一次免费测试，您看看效果再决定。\"",
    "riskPoints": [
      "最大翻车点：AI生成的文书\"AI味\"太重，被学校识别出来",
      "提前规避：①在Prompt中加入去AI化指令；②生成定位是\"初稿\"而非\"成品\"；③提供\"AI味检测\"功能",
      "合同条款：①交付的是\"辅助工具\"而非\"成品文书\"；②不保证生成内容的原创性检测通过率；③客户需自行审核修改",
      "停止条件：客户要求\"直接交付可提交的成品文书\"，超出工具定位"
    ],
    "keyLearning": "",
    "customerQuote": "小赵，我想找你帮我做一个AI文书辅助工具。不是完全让AI写，是帮我们的文案老师提效。比如输入学生背景，AI先出一个初稿，然后我们的老师再改。你能做吗？",
    "surfaceNeed": "AI辅助写留学文书",
    "realNeed": "定制化文书生成系统：输入学生信息→输出PS/CV/推荐信初稿→支持按学校要求调整",
    "hiddenRisks": [
      "①文书质量要求高，AI写的可能需要大量人工修改；②不同学校对文书有不同要求；③涉及学生隐私数据"
    ],
    "worthTaking": true,
    "firstRoundQuestions": [
      "Amy老师，你们现在写一篇PS大概要多长时间？",
      "你们有没有文书模板库或者过往优秀文书？",
      "你们主要申请哪些学校？不同学校的文书要求差别大吗？"
    ],
    "acceptanceCriteria": "生成的文书初稿质量达到\"可修改后直接使用\"水平，支持至少5所目标学校的定制化",
    "biggestRisk": "AI生成的文书\"AI味\"太重，被学校识别出来",
    "stopConditions": [
      "客户要求\"直接交付可提交的成品文书\"，超出工具定位"
    ]
  },
  {
    "id": 5,
    "customerType": "未知",
    "name": "张总",
    "age": 40,
    "location": "北京",
    "industry": "",
    "description": "张总，40岁，北京，中型留学中介，20人团队，主做美国Top50申请。成立8年，年服务200+学生。选校全靠顾问经验，新顾问上手慢，经常出现选校不合理的情况。想做一个智能选校系统，提高选校准确率，也能作为获客工具。真实愿意付钱的点：标准化选校流程、培训新顾问、获客转化。",
    "painPoint": "",
    "willingness": "",
    "budget": "",
    "difficulty": "高",
    "quote": {
      "low": 5000,
      "standard": 12000,
      "high": 20000,
      "recommended": 12000
    },
    "product": "",
    "deliveryDays": "14-20天",
    "communicationTips": "第一轮问什么：\n- \"张总，你们现在选校主要看哪些维度？GPA、语言、软背景、专业匹配？\"\n- \"你们有历史录取数据吗？过往学生被哪些学校录取了？\"\n- \"这个系统是内部用还是对外获客用？\"\n第二轮确认什么：数据来源和更新机制、UI设计要求、是否需要用户注册和数据收集功能\n判断预算：中型机构预算8000-20000元。\n判断麻烦客户：偏麻烦。数据量大，需求可能不断膨胀。\n引导模糊需求：\"张总，我建议分两期做：第一期先做MVP，基于现有录取数据做推荐；第二期再加用户管理和获客功能。\"",
    "closingScript": "微信版：\"张总，12000做一套完整的智能选校系统，学生输入成绩就能出推荐，还能收集用户信息做后续跟进。以后在小红书推广直接放这个链接，获客效率翻倍。\"\n应对太贵：\"张总您算一下，这个系统一年能帮您多签几个学生？一个学生的中介费就回本了。\"\n应对考虑一下：\"没问题张总。不过建议尽快启动，9月申请季之前做好，正好赶上旺季推广。\"",
    "riskPoints": [
      "最大翻车点：选校推荐不准，客户学生投诉，影响机构口碑",
      "提前规避：①明确告知\"推荐仅供参考\"；②页面加免责声明；③基于历史数据验证准确率",
      "合同条款：①系统提供\"推荐建议\"而非\"录取保证\"；②客户需定期更新数据；③不对推荐结果准确性承担法律责任",
      "停止条件：客户要求系统输出\"保证录取\"类承诺"
    ],
    "keyLearning": "",
    "customerQuote": "赵老师，我们想开发一个AI选校系统，学生输入GPA、语言成绩、实习经历这些，系统自动推荐合适的学校。我们在小红书上做推广用。你看看能做吗？",
    "surfaceNeed": "AI智能选校推荐系统",
    "realNeed": "前端交互页面，学生输入背景信息→系统基于历史数据和AI分析→输出选校建议（冲刺/匹配/保底）",
    "hiddenRisks": [
      "①选校数据需要持续更新；②推荐结果如果不准会影响机构口碑；③获客工具需要吸引人"
    ],
    "worthTaking": true,
    "firstRoundQuestions": [
      "张总，你们现在选校主要看哪些维度？GPA、语言、软背景、专业匹配？",
      "你们有历史录取数据吗？过往学生被哪些学校录取了？",
      "这个系统是内部用还是对外获客用？"
    ],
    "acceptanceCriteria": "选校推荐准确率（基于历史数据验证）达到70%以上，页面美观适合推广",
    "biggestRisk": "选校推荐不准，客户学生投诉，影响机构口碑",
    "stopConditions": [
      "客户要求系统输出\"保证录取\"类承诺"
    ]
  },
  {
    "id": 6,
    "customerType": "未知",
    "name": "小林",
    "age": 27,
    "location": "广州",
    "industry": "",
    "description": "小林，27岁，广州，留学自媒体博主，全职做小红书+公众号，粉丝3万+。一个人运营，偶尔找兼职写手。每天需要更新内容，但写不过来，质量在下降。想用AI辅助写留学干货文章，提高产出效率。真实愿意付钱的点：节省时间，保持更新频率，不影响广告收入。",
    "painPoint": "",
    "willingness": "",
    "budget": "",
    "difficulty": "低",
    "quote": {
      "low": 500,
      "standard": 1500,
      "high": 3000,
      "recommended": 1500
    },
    "product": "",
    "deliveryDays": "5-7天",